title,category
한동훈  파도 물러났고 김의겸  법적 책임지면 돼 ,Politics
   수출전략 첫 현장은 방산  게임체이저급 무기개발하자 ,Politics
 돈줄  해킹  건들자  외교부 것들   급  낮춰 발끈한 김여정,Politics
   이재명 가족 계좌 추적 영장 망신주기 의도 뻔해 ,Politics
김만배  천화동인  호 실소유주는 바로 나  발언 유효할까,Politics
한동훈  김의겸 사과할 필요 없다  이번엔 법적 책임 물을 것 ,Politics
 아니면 말고   김의겸  유감  표명에 국민의힘 징계 사퇴 요구,Politics
 한동훈 청문회 헛발질 보라     이태원 국정조사  믿는 구석,Politics
정진상 구속적부심  기각      진실의 시간  이재명으로 직진 ,Politics
  난 이재명과 정치공동체다  정청래 지지자들  방탄 캠페인,Politics
 최측근  정진상  구속적부심 기각 이재명에 쏠리는   의 눈,Politics
   의총서 대검 국조 대상  마약수서  부서로 한정,Politics
 한반도의 오늘   열일 하는 조선우표사 체제선전 위해 올해 우표 발행 급증,Politics
 청담동 술자리 의혹  제기 김의겸    등에 유감       사퇴하라 ,Politics
 김의겸이 또 김의겸했다  민주당 덮친  거짓말 리스크 ,Politics
전투기부터 전차까지 챙긴  대통령  다른 수출과 차원 달라 ,Politics
한동훈  이재명 박찬대 장경태 사과해야 김의겸은 법적 책임 물을 것 ,Politics
 여의도 번지  국정조사 특위 첫 회의부터 불발 대검 포함 여부 충돌,Politics
김의겸  아니면 말고 식 폭로  확인되자 정치권  문책해야  맹폭,Politics
 년전  언론징벌법  띄웠던        엄호 위해  방송법  띄웠다,Politics
 당권경쟁 불붙나       연대설 에 친윤모임도 곧 출범,Politics
김종민  이재명  방탄정당  되면 오히려   정권에 보조 맞추는 것 ,Politics
   이재명 압박  당당하면 수사 협조    대표직 결단하라  종합 ,Politics
    제 노조       편파보도  꼬집으며 이재명  인터뷰 커트  논란 재소환,Politics
   첫 방산수출전략회의 주재    첨단산업 견인 중추   정부가 적극 지원  종합 ,Politics
고양시  테슬라 아시아 호  기가팩토리  유치 추진,Politics
    청담동 술자리 의혹  김의겸에  거짓말 제조기 사퇴가 사죄 ,Politics
 자막뉴스     무슨 제안했길래   한국  콕  집은 일론 머스크,Politics
이재명 측근 정진상  구속적부심 기각,Politics
김여정  윤석열 천치바보  담화에 통일부  국가원수에 저급한 막말 ,Politics
김의겸   청담동 술자리는 거짓  진술에  대통령께 심심한 유감 ,Politics
 해군 신형고속정   척    중공업 수주     억원 건조 계약,Politics
민주  이재명 자택 현금 출처 의혹에  악의적 주장  반박,Politics
장갑차에 적은  세계 시장 석권    대통령  방산 수출 필수 ,Politics
조원진    김여정  사실상 윤석열 퇴진 촛불 지령 내린 셈 ,Politics
민주당 인사들  이재명  최측근 구속 관련 입장표명해야 ,Politics
윤상현  이재명  그만 내려와라 민주당도   떠나보낼 때 ,Politics
조원진    김여정  사실상 윤석열 퇴진 촛불 지령내린 셈 ,Politics
 나혼산  비판한 나경원   고딩엄빠  같은 프로그램은 저출산 극복에 도움 ,Politics
이태원 참사 국정조사  국민의힘  대검은 빼라 에 초장부터 난항,Politics
 이앤피   이변 속출 카타르 월드컵  한국 우루과이     또는     기대 ,Politics
   용산발 국정조사 비상  지도부 만난 이진복 비공개 의총,Politics
 정조대왕급  이지스구축함  번함 건조 사업  현대중공업 단독 입찰,Politics
 사실이라면  조건 단 김의겸  한동훈 빼놓고   사과  대신  유감 ,Politics
   서해 피격  서훈 소환    박지원 전 국정원장 조사도 초읽기,Politics
    석 병참기지였는데  민주    이재명 사법리스크 에 수난,Politics
 뉴스외전 포커스  최재성  대통령에 대한  천공 의 영향력을 의심할 수밖에 ,Politics
화물연대 총파업에    대국민 협박     정부가 서슬퍼런 말로 윽박 ,Politics
 이재명 태도에 불만   사과해야  민주당 원로 유인태  직격탄 ,Politics
  방산      년까지 세계시장    점유한다,Politics
   남북회담서 벤츠 탄  은 부끄러운 대통령인가   의전차량 지적 일축,Politics
자충수 된  청담동 술자리    그간 민주당 발언 보니,Politics
김여정 담화에 대통령실 대신 통일부 나선 이유  저급하고 예의 없어 ,Politics
       부국장      정상각도 로      시험발사할 가능성 높아 ,Politics
 더뉴스   술자리 의혹  김의겸  윤 대통령 등에 유감         사퇴해야 ,Politics
김도읍  국조  대검  포함에  번복 아냐   무관 확인되면 수정해야 ,Politics
청담동 술자리 없었다 국민의힘  김의겸은  거짓말 자판기  민주는  더불어거짓당  ,Politics
민노총 총파업 때린    물류 볼모잡은  안전운임제   화물차 사고와 운임비만 늘었다 ,Politics
홍준표 대구시장     묘지 참배 취소에도 오월단체  어디든 따라갈 것 ,Politics
한 총리  국조 증인 출석할 것 화물연대 운송거부  대단히 유감 ,Politics
 이재명 최측근  정진상 적부심 기각 구속 유지,Politics
 속보   이재명 최측근  정진상 적부심 기각 구속 유지,Politics
 속보   이재명 최측근  정진상 적부심 기각 구속 유지,Politics
통일부   막말 비난  김여정에  개탄스러워 도적이 매 드는 식 ,Politics
안철수  이재명  스스로 대표직 내려놓는 게 정치의 상식 ,Politics
방산수출전략회의 주재한  대통령  기술패권 경쟁 시대  게임체인저급 무기체계 개발해야 ,Politics
 이슈   김여정  대남 막말 비난 통일부  매우 개탄 ,Politics
당심 고삐 당기는 김기현 공부모임서  세  보이고     날 세우기,Politics
 자막뉴스  막말 비난 쏟아낸 김여정    남남갈등 조장까지,Politics
여야  과방위 소위서  방송법 개정  또다시 원점    당론 정해 다시 논의 종합 ,Politics
    억원 이상 안돼     문턱효과 우려  다주택 종부세 공제기준 이견,Politics
  방산      년까지 세계 점유율    목표 민관군 합동 전략회의,Politics
 적대적 언론관  주류와 거리 두는 안철수 당권 경쟁 시작되나,Politics
   총파업은  정권퇴진  운동 대국민 폭거 ,Politics
    청담동 술자리  새빨간 거짓말로 김의겸  사퇴해야 ,Politics
   퇴진 집회  황운하      검찰개혁  제대로 못한 혹독한 대가 치르고 있어 ,Politics
   한동훈 청담동 술자리 의혹  첼리스트   거짓말했다  진술 경찰  허위 사실 유포 경위 수사,Politics
  김여정 또 말폭탄     방관  속 추가 도발 임박했나,Politics
   카타르 월드컵 녹화중계     정국 개막식 공연은 빼먹어,Politics
민주   합의 뒤집기  권성동 망령  격앙   원안으로    단독 국조 추진,Politics
국정조사 합의 다음날 돌변한 국민의힘  대검은 빼자   이태원 압사 참사 ,Politics
   한동훈 술자리 의혹 은 거짓말  정진석  녹음 폭로된 첼리스트  얼마나 괴로웠을까 ,Politics
한동훈은 빼놓고   사실이라면  조건 달고    김의겸의  이상한 유감 ,Politics
합의 하루만에  대검찰청 제외  요구하며 입장 바꾼 국민의힘 영상 ,Politics
 이앤피         정상회의 때 현대차 대신 벤츠 탔다는 현지언론 보도   ,Politics
청담동 술자리는 없었다   첼리스트  거짓말  진술,Politics
 당권주자  나경원  김기현 모임  새미래 서 강연 연대설  솔솔 ,Politics
첼리스트 전 남친  권익위에  술자리 물증  안 냈다 공익신고자 안 될 듯,Politics
      방산  드라이브  세계  대 방산 수출 강국 도약 범정부 수출지원 ,Politics
 술자리 의혹 제기  김의겸  그날로 되돌아간다 해도 같은 질문할 것 ,Politics
검찰  이재명 김혜경 계좌 등 추적중  김용 정진상 대장동 돈 관련 ,Politics
 투기 의혹  서경석 전북개발공사 사장 사직 전북 떠나 종합 보 ,Politics
 국조 대상서 대통령실 빠졌다 에 이진복  뭐가 많이 빠졌냐 ,Politics
추가 제재론 나오니   김여정   서울   타격  막말,Politics
  핵잠수함  토마호크    발 탑재      근해서 작전 수행,Politics
엑스포 내주고  네옴  따냈다  박진    사우디 빅딜설에  사실 아니다 ,Politics
김의겸   술자리 제보자 거짓말 진술 에  윤 대통령에 심심한 유감 ,Politics
안철수  거대한 검은 코끼리  이재명   이젠 몰아내야 이대로 둘 수 없다 ,Politics
 이재명 자택서  억대 현금  들고 나왔다   민주  악의적 주장 ,Politics
정진석  민주당 지도부  지라시 뉴스  생산   사생활 까발려진 한 여인 울고 있다 ,Politics
 이재명 방탄당  이러다 제 의 조국사태 된다  커지는   위기감,Politics
 이태원 국조  시작부터 삐걱      대검은 빼자  회의 불참,Politics
 청담동 술자리 다 거짓말 남친 속이려한 것    첼리스트  경찰에 진술,Politics
유인태     멘토 조언에도  인간 자체가 싫다 며 이재명 안 만나 ,Politics
유인태  이재명 직격  유동규 중용한 사람 누군가      사과해야 ,Politics
 뉴스        이태원 참사 국조  첫날부터 삐걱     대검 빼달라     합의된 사항 ,Politics
안철수  이재명  스스로 대표직 내려놓는 게 정치의 상식 ,Politics
정진석  김의겸 민주당에 사생활 까발려진 한 여인이 울고 있다 ,Politics
유상범  김의겸  청담동 술자리 의혹  유감표명 진정성 없는 말장난 ,Politics
군  김여정 담화에  동의할 사람 아무도 없을 것 ,Politics
 뉴스앤이슈    일간  이태원 국정조사     본격 조사는 예산안 처리 후 착수,Politics
  이태원 국조위원들  어제 합의  어떻게 깨나   로비 의심 ,Politics
   대검 안 돼        합의 파기  이태원 국조 첫날부터 파행 종합 ,Politics
이재명 위기에 목소리 높이는 비명계      목표   제거 아냐  방탄정당 만드는 것 ,Politics
 영상  민주 과방위원들      민영화  아직 끝난 게 아니다 ,Politics
공군  최우수 방공무기통제사  골든아이  김상훈 천호정 준위,Politics
여야  공수처 청사 신축 예산  대치  기재부 예산안 의결 실패,Politics
정진석  엉터리 청담동 제보  주옥같던 민주 지도부 폭로전 여성 사생활에도 폭력 ,Politics
 뉴스킹    국정지지율   김준일     와 싸움만 남아   배종찬  정치적 개기일식 현상 ,Politics
안철수  이재명은  검은 코끼리    민주당 아무 일 못해 ,Politics
   국조 대상에 대검 빼달라  요구에 국조특위 첫 회의 파행,Politics
김여정  윤대통령 향해 막말 비난 통일부  매우 개탄 ,Politics
안철수  이재명  대한민국 근본 흔들고 훼손 스스로 대표직 내려놔야 ,Politics
태영호  김여정 막말 담화로  국민 이간질 넘어가면 안돼 ,Politics
황교익도  청담동 가짜뉴스  더탐사 직격  변명 여지 없어  거짓말  사과해야 ,Politics
 대통령  전투기 공장서  방산수출전략회의   미래 중추 ,Politics
황교익   청담동 술자리 의혹  보도 매체  거짓 중계 사과해야 ,Politics
 서울 과녁  김여정 겁박에 국힘  평화사기쇼 문재인  왜 항변 않나  ,Politics
암호화폐 등 독자 제재 논의에    격한  반응  왜 ,Politics
김여정  천치바보 정권  막말 공세 정부  개탄  강한 유감 ,Politics
    이재명 수사 공식화 에  민주당 뒤 숨지 말고 협조  압박,Politics
조응천  이재명  정치적 책임에 유감 표명해야 사실관계에 당 직접 대응  불편 ,Politics
최연혜 가스  사장 내정에    낙하산     공사 적자해결 ,Politics
통일부  김여정  막말  담화에  도적이 매를 드는 식 매우 개탄  종합 ,Politics
유인태     멘토 조언에도  이재명 싫다 며 안 만나 ,Politics
김기현 공부모임에  나경원 강연하고  안철수도 참석,Politics
윤석열 대통령 문제적 발언부터 해명까지    시간  전말은,Politics
 이태원 참사    국조 수용  용산과 교감했나 당 일각선 반대 여전,Politics
화물연대 총파업에    대국민 협박      정부 무책임 때문 ,Politics
비명계  이재명  정치적 책임 져야  입장 표명 할까,Politics
   국조 특위 첫날부터 이상민 사퇴 압박  상습 거짓말  종합 ,Politics
 술자리 의혹  김의겸  윤 대통령 등에 유감       사퇴해야 ,Politics
이재명 사법리스크   김의겸 가짜뉴스   노웅래 수뢰의혹 수렁에 빠진   ,Politics
 아니면 말고  김의겸  당 안팎서 책임론 확산,Politics
  이번 주에만 담화 세 번      후  추가 대응   무엇을 준비하나,Politics
 이태원 국조  첫 회의부터 파행    대검 빼야      합의 대로 ,Politics
 군대클라쓰  속초 앞바다 북한 미사일  어떻게 찾았을까 해군    편,Politics
    맏형 진  크리스마스 앞두고 최전방 신병교육대로 입대,Politics
   대검 빼달라     합의된 사항  이태원 국조 특위 돌연 연기,Politics
나경원 안철수 불러모은 김기현 공부모임   친윤 모임도 다시 뜬다,Politics
여야  방송법 전쟁  돌입     언론장악 막아야      악법 중 악법 ,Politics
비명계  민주당의 이재명 방어에  제 의 조국사태  우려,Politics
전   현정권 비교하며  남남갈등 조장   김여정   천치바보  들먹이며  저급한 막말 ,Politics
미국   토마호크    발  핵잠수함 일본 오키나와 기항 이례적 공개,Politics
김의겸   청담동 술자리  의혹 접고 사과   대통령 등에 심심한 유감 ,Politics
화물연대 파업 직격한 정진석  민주노총  국가물류 볼모로 정권퇴진 운동 ,Politics
  양금희  대장동 형제들 잇단 폭로   이재명 빠져나갈 확률    ,Politics
 약자 복지  공공임대주택 예산 국토위 통과    국힘 전원 불출석,Politics
 뉴스포커스  김여정  윤대통령 실명 막말  서울 과녁 까지 언급,Politics
국힘  첼리스트  청담동 술자리  거짓말 가짜뉴스 대변인 김의겸 의원직사퇴해야 ,Politics
김의겸  술자리 거짓말  진술에  유감 제보 확인은 당연히 할 일 ,Politics
조응천  노무현도 안희정 구속 때 절절히 유감 표명  이재명도 해야 ,Politics
김의겸    등 관련된 분들께 심심한 유감   청담동 술자리 의혹  사과,Politics
   이재명 방탄  프레임에 소환되는  조국 사태 ,Politics
 반드시 모셔오라       유진 초이 황기환  유해 봉환  특명   여의도초대석 ,Politics
김여정   대통령 막말 비난  천치바보를 왜 보고만 있나  종합 보 ,Politics
       틀린 자막 씌워     웃프다  웃긴데 되게 슬픈거 ,Politics
청담동  가짜뉴스  드러나도 김의겸  그날 돌아가도 똑같이 물을것 ,Politics
올해의  탑 헬리건  김용진 대위  최정예 되도록 최선 ,Politics
이재명  패륜예산  비판에    성일종  형수 욕설한 사람 할말 아냐 ,Politics
화물연대에 날세운 국민의힘  세력확장 불순한 저의 ,Politics
통일부  김여정  막말  담화에  도적이 매를 드는 식 매우 개탄 ,Politics
첼리스트  거짓말  진술에   김기현   김의겸 의원직 사퇴해야 ,Politics
청담동 술자리 헛발질 김의겸   국힘  책임지고 사퇴 ,Politics
신원식  김여정 막말  스스로 천박성 전 세계에 광고 ,Politics
 김기현 새미래 에 국민의힘 당권주자 집결 나경원  모두 하나 돼야 ,Politics
     술자리 의혹 거짓으로 드러나  김의겸 사퇴해야 ,Politics
 속보  김의겸  청담동 술자리  가짜뉴스  논란에  다시 그날로 되돌아간다 해도  ,Politics
김의겸  청담동 술자리  거짓말  진술에도  돌아가도 같은 질문     에 유감,Politics
김의겸   술자리 거짓말  진술에도  그날로 돌아가도 같은 질문할 것 ,Politics
나경원   고딩엄빠   슈퍼맨  저출산 극복에 좋은 프로그램 ,Politics
 풍계리  번 갱도  여전히 작업중    핵잠수함     로 압박,Politics
유가족   대통령에게 행정부 수반으로서 진심어린 사과 원해 ,Politics
김의겸   술자리 제보자 거짓말 진술 에   에 심심한 유감 ,Politics
  대통령 등 관련된 분들께 심심한 유감  김의겸  청담동술자리 의혹 사과,Politics
 예산  조 줄고   예산  조 늘고     조 감세도  뇌관      조 예산전쟁 ,Politics
 단독  술자리 물증 안냈다  첼리스트  남친 공익신고 안될듯,Politics
성일종   패륜예산  이재명에   대표가  패륜 이란 말 쓰면 안돼 ,Politics
국방부  김여정  막말  담화에  동의할 사람 아무도 없어 ,Politics
역대 민선 제주지사 선거법과 악연 줄줄이 법정에 서,Politics
툭하면  보류  밀실로 넘어가는 예산심사,Politics
 속보 통일부  김여정에  도적이 매를 드는 식   국가원수에 저급한 막말 개탄 ,Politics
남남갈등 반정부투쟁 선동 김여정    천치바보  막말,Politics
김종민  당 차원에서 이재명 보호하면  제  조국사태  온다 ,Politics
김여정    저 천치바보  통일부  저급한 막말  매우 개탄 ,Politics
   한동훈 청담 술자리 는 거짓말  김의겸  심심한 유감     의원직 사퇴를 ,Politics
북한  가상화폐 탈취해 미사일 개발 마르지 않는 돈줄로 거침없이 도발,Politics
김기현 모임에   명 성황   연사  나경원  정권교체 완성은 총선 ,Politics
김의겸  청담동 술자리 제보자  거짓말  경찰 진술 사실이라면    등에 심심한 유감 ,Politics
   첼리스트  남친 속이려 거짓말    김의겸  대국민사과 사퇴 해임 촉구 ,Politics
 대국민사과 사퇴 해임 촉구 ,Politics
